,product_id,shop_id,short_description,price,discount,final_price,sold_product,rating_count,location,brand
405,2546725471,99552004,"Camera cặp lề, camera căn lề phải, xoay 360 độ, chống nước, độ phân giải 650 TV Line",35000000000,43,19900000000,94,"[35, 0, 1, 1, 1, 32]",Hà Nội,
406,9453765435,439687527,Giá đỡ camera hành trình ô tô và camera dạng hít,2500000000,42,1450000000,597,"[98, 1, 0, 1, 7, 89]",Hà Nội,
407,17074208365,131720381,Camera Chiếu Hậu Chất Lượng Cao Cho Xe Hơi Ford Transit,22200000000,21,17600000000,10,"[4, 0, 0, 0, 0, 4]",Nước ngoài,
408,2105142783,35463152,Camera lùi nấm CCD thẩm mỹ xe hơi ô tô HD hình nấm có thang chia vạch thông minh,0,0,12600000000,140,"[37, 4, 0, 1, 3, 29]",Hà Nội,No brand
409,4963776127,99552004,"Camera cặp lề cho màn hình android, góc quay siêu rộng, siêu rõ nét, độ phân giải HD 720p - 1280x720, 360",75000000000,32,51000000000,5,"[2, 0, 0, 0, 0, 2]",Hà Nội,No Brand
410,1361285268,31861340,Combo 2 miếng dán chống bám nước cho gương chiếu hậu,2500000000,40,1500000000,1084,"[327, 3, 3, 5, 14, 302]",Ninh Bình,No brand
411,5160769702,95745903,Set 4 Nắp Chụp Mâm Bánh Xe 60mm Cho Ford 2020,17829100000,10,16046200000,15,"[0, 0, 0, 0, 0, 0]",Nước ngoài,
412,18417680901,775951608,Camera Hành Trình ô tô AUKEY DRA1 1080P FHD cảm biến cảnh báo va chạm/ chệch làn đường hỗ trợ GPS/ ghi âm ban đêm,99900000000,38,62000000000,22,"[11, 0, 0, 0, 1, 10]",Hà Nội,
413,7545113245,82328273,"Màn hình hiển thị camera cặp lề, camera lùi",0,0,45000000000,4,"[1, 0, 0, 0, 0, 1]",TP. Hồ Chí Minh,No brand
414,9220795758,99552004,"Camera cặp lề AHD, độ phân giải HD-720P, không cần khoan gương| Lắp được cả màn TFT và AHD, CCD",65000000000,39,39900000000,20,"[5, 0, 0, 0, 0, 5]",Hà Nội,No brand
415,12683808775,279844729,"Camera ghi hình trước và sau cho xe hơi 1080P
",0,0,99000000000,3,"[0, 0, 0, 0, 0, 0]",Nước ngoài,
416,2563881101,135245218,Giá đỡ camera có cốc hút chân không gắn kính chắn gió dành cho xe hơi,3200000000,14,2768000000,61,"[10, 0, 0, 0, 2, 8]",Nước ngoài,Bluelans
417,16642213746,561305325,Camera hành trình 70mai Dash Cam 70MAI 1S D06 Điều khiển qua App và giọng nói Góc quay rộng 130° 1080P,129800000000,32,88900000000,3,"[1, 0, 0, 0, 0, 1]",TP. Hồ Chí Minh,
418,13861182401,22020379,Camera lùi xe hơi AHD 4K Aurora,0,0,15000000000,8,"[3, 0, 0, 0, 0, 3]",TP. Hồ Chí Minh,
419,16331803990,279844729,"Camera chiếu hậu 360 độ cho xe hơi
",30000000000,34,19700000000,9,"[1, 0, 0, 0, 1, 0]",Nước ngoài,
